{
    "scenario": "oud",
    "aanvrager": {
        "naam": "Ingrid Larsen",
        "email": "oud2@example.com"
    },
    "nieuwAdres": "Oudestraat 2, 7000 GG Testdorp",
    "status": "ingediend",
    "spoed": false,
    "aantalPersonen": 2,
    "woning": {
        "oppervlakte": 90,
        "energielabel": "C"
    }
}
